<?xml version="1.0" encoding="UTF-8"?>
<FMS
  xmlns:xsi="http://www.w3.org/2001/XMLSchema-instance"
  xsi:noNamespaceSchemaLocation="FMS.xsd">
  <StartingTime>15:03:07</StartingTime>
  <Power LocalTimestamp="15:03:37">
    <Voltage>0.000</Voltage>
    <VoltageCell>0.000</VoltageCell>
    <Current>0.000</Current>
  </Power>
  <ConnectionQualitySens LocalTimestamp="15:03:39">
    <Quality>1.000</Quality>
  </ConnectionQualitySens>
  <Status LocalTimestamp="15:03:40">
    <Flags>
      <adc_initialized>true</adc_initialized>
      <dac_initialized>true</dac_initialized>
      <dma_initialized>true</dma_initialized>
      <flash_ssp_initialized>true</flash_ssp_initialized>
      <i2c0_initialized>true</i2c0_initialized>
      <i2c1_initialized>true</i2c1_initialized>
      <i2c2_initialized>true</i2c2_initialized>
      <uart0_initialized>true</uart0_initialized>
      <uart1_initialized>true</uart1_initialized>
      <uart2_initialized>false</uart2_initialized>
      <uart3_initialized>true</uart3_initialized>
      <rtc_initialized>true</rtc_initialized>
      <ssp1_initialized>true</ssp1_initialized>
      <structs_initialized>true</structs_initialized>
      <systick_initialized>true</systick_initialized>
      <timer1_initialized>true</timer1_initialized>
      <watchdog_initialized>true</watchdog_initialized>
      <eeprom_initialized>true</eeprom_initialized>
      <ars_initialized>false</ars_initialized>
      <power_management_initialized>true</power_management_initialized>
      <flash_initialized>true</flash_initialized>
      <seven_segment_intern_initialized>true</seven_segment_intern_initialized>
      <seven_segment_extern_initialized>false</seven_segment_extern_initialized>
      <startup_success>true</startup_success>
      <sensor_pressure_initialized>true</sensor_pressure_initialized>
      <startup_checked>true</startup_checked>
      <sensor_imu_initialized>true</sensor_imu_initialized>
      <sensor_tmp100_initialized>false</sensor_tmp100_initialized>
      <sensor_hig_initialized>true</sensor_hig_initialized>
      <sensor_gyro_initialized>true</sensor_gyro_initialized>
      <gnss_initialized>true</gnss_initialized>
      <servo_initialized_all>false</servo_initialized_all>
      <pwm_initialized>true</pwm_initialized>
      <afs_initialized>true</afs_initialized>
      <camera_initialized>false</camera_initialized>
      <sensor_current_initialized>false</sensor_current_initialized>
      <igniter_initialized>true</igniter_initialized>
      <separation_detection_initialized>true</separation_detection_initialized>
      <servo_configured>false</servo_configured>
      <igniter_configured>true</igniter_configured>
      <igniter_1_fired>false</igniter_1_fired>
      <igniter_2_fired>false</igniter_2_fired>
      <igniter_3_fired>false</igniter_3_fired>
      <igniter_4_fired>false</igniter_4_fired>
      <igniter_1_firing>false</igniter_1_firing>
      <igniter_2_firing>false</igniter_2_firing>
      <igniter_3_firing>false</igniter_3_firing>
      <igniter_4_firing>false</igniter_4_firing>
      <igniter_armed>false</igniter_armed>
      <igniter_1_connected>false</igniter_1_connected>
      <igniter_2_connected>false</igniter_2_connected>
      <igniter_3_connected>false</igniter_3_connected>
      <igniter_4_connected>false</igniter_4_connected>
      <ars_enabled>false</ars_enabled>
      <camera_on>false</camera_on>
      <gnss_powersave>false</gnss_powersave>
      <flash_erased>false</flash_erased>
      <flash_store_data>false</flash_store_data>
      <radio_on>true</radio_on>
      <radio_tx_active>true</radio_tx_active>
      <flash_flight_header_written>false</flash_flight_header_written>
      <timer1_running>true</timer1_running>
      <rtc_synchronized>false</rtc_synchronized>
      <usb_connection_detected>true</usb_connection_detected>
      <watchdog_timeout_occured>false</watchdog_timeout_occured>
      <flash_full>false</flash_full>
      <crystal_oszillator_used>true</crystal_oszillator_used>
      <liftoff_detected>false</liftoff_detected>
      <gnss_fix>false</gnss_fix>
      <rocket_panic>false</rocket_panic>
      <mainchute_altitude_detected>false</mainchute_altitude_detected>
      <eagle_landed>false</eagle_landed>
      <rocket_is_stable>true</rocket_is_stable>
      <apogee_detected_by_kalman>false</apogee_detected_by_kalman>
      <recovery_mode>false</recovery_mode>
      <check_stability_executed>false</check_stability_executed>
      <config_intialized>true</config_intialized>
      <stages_separated>true</stages_separated>
      <igniter_hpower_fired>false</igniter_hpower_fired>
      <igniter_hpower_firing>false</igniter_hpower_firing>
      <igniter_hpower_connected>false</igniter_hpower_connected>
      <reset_during_flight>false</reset_during_flight>
      <housekeeping_data_read>true</housekeeping_data_read>
      <mbb_satcom_configured>true</mbb_satcom_configured>
      <mbb_satcom_initialized>true</mbb_satcom_initialized>
      <mbb_cameras_configured>true</mbb_cameras_configured>
      <mbb_cameras_initialized>true</mbb_cameras_initialized>
      <power_management_operational>false</power_management_operational>
      <rail_5v_enabled>true</rail_5v_enabled>
      <padding1>false</padding1>
      <padding2>false</padding2>
      <battery_overvoltage>false</battery_overvoltage>
      <battery_only_attached>false</battery_only_attached>
      <rail_3v3_sensor_enabled>true</rail_3v3_sensor_enabled>
      <rail_3v3_gnss_enabled>true</rail_3v3_gnss_enabled>
      <rail_3v3_external_enabled>true</rail_3v3_external_enabled>
      <cmd_buffer_overrun>false</cmd_buffer_overrun>
      <eeprom_page_cycle_overflow>false</eeprom_page_cycle_overflow>
      <flash_dma_buffer_overrun>false</flash_dma_buffer_overrun>
      <flash_write_error>false</flash_write_error>
      <i2c_job_buffer_overflow>false</i2c_job_buffer_overflow>
      <i2c_interrupt_handler_error>false</i2c_interrupt_handler_error>
      <interrupt_interference>false</interrupt_interference>
      <uart0_tx_buffer_overflow>false</uart0_tx_buffer_overflow>
      <uart0_rx_buffer_overflow>false</uart0_rx_buffer_overflow>
      <uart1_tx_buffer_overflow>false</uart1_tx_buffer_overflow>
      <uart1_rx_buffer_overflow>false</uart1_rx_buffer_overflow>
      <uart2_tx_buffer_overflow>false</uart2_tx_buffer_overflow>
      <uart2_rx_buffer_overflow>false</uart2_rx_buffer_overflow>
      <uart3_tx_buffer_overflow>false</uart3_tx_buffer_overflow>
      <uart3_rx_buffer_overflow>false</uart3_rx_buffer_overflow>
      <ssp1_interrupt_ror>false</ssp1_interrupt_ror>
      <ssp1_interrupt_unknown_device>false</ssp1_interrupt_unknown_device>
      <ssp1_buffer_overflow>false</ssp1_buffer_overflow>
      <watchdog_interrupt_handler_hit>false</watchdog_interrupt_handler_hit>
      <flight_substate_default_handler_hit>false</flight_substate_default_handler_hit>
      <rocket_state_default_handler_hit>false</rocket_state_default_handler_hit>
      <struct_size_overflows_uart_buffer>false</struct_size_overflows_uart_buffer>
      <config_from_eeprom>true</config_from_eeprom>
      <event_actions_from_eeprom>true</event_actions_from_eeprom>
      <brown_out_warning_level_interrupt_hit>false</brown_out_warning_level_interrupt_hit>
      <lora_overtemperature>false</lora_overtemperature>
      <lora_critical_temperature>false</lora_critical_temperature>
      <mbb_satcom_running>false</mbb_satcom_running>
      <mbb_cameras_running>false</mbb_cameras_running>
      <development_mode>true</development_mode>
      <servo_sweep_in_progress>false</servo_sweep_in_progress>
      <powerdown_desired>false</powerdown_desired>
    </Flags>
    <Timestamp>571991</Timestamp>
    <Rocket_state>1</Rocket_state>
    <Flight_substate>0</Flight_substate>
    <Servo_pos>
      <Array>
        <Element0>0</Element0>
        <Element1>0</Element1>
        <Element2>0</Element2>
      </Array>
    </Servo_pos>
    <Sepadet_adc_value>4095</Sepadet_adc_value>
    <Radio_tx_byte_counter>0</Radio_tx_byte_counter>
    <Flash_adr>0</Flash_adr>
    <Seven_segment_value>U</Seven_segment_value>
    <Cpu_load>0</Cpu_load>
    <Igniter_adc_voltage>0</Igniter_adc_voltage>
    <Liftoff_timestamp>0</Liftoff_timestamp>
    <Apogee_timestamp>0</Apogee_timestamp>
    <Mainchute_timestamp>0</Mainchute_timestamp>
    <Landing_timestamp>0</Landing_timestamp>
    <Igniter_1_voltage>0</Igniter_1_voltage>
    <Igniter_2_voltage>0</Igniter_2_voltage>
    <Igniter_3_voltage>0</Igniter_3_voltage>
    <Igniter_4_voltage>0</Igniter_4_voltage>
    <Igniter_hpower_voltage>633</Igniter_hpower_voltage>
    <Orientation_of_fms>Y_PLUS</Orientation_of_fms>
  </Status>
</FMS>
